cluster,frase_exemplo,ativo_cluster,n_eventos,frases_originais,seq_d0,seq_d1,seq_d2,seq_d3,seq_d4,seq_d5
45,Posse de novo presidente indicado pelo governo,PETR4,1,['Posse de novo presidente indicado pelo governo'],-2.0000033533584722,,,,,
46,Declarações do presidente Jair Bolsonaro influenciam o mercado de combustíveis.,PETR4,1,['Declarações do presidente Jair Bolsonaro sobre combustíveis'],-4.889643524500517,1.7493634404521945,,,,
47,Previsibilidade na gestão empresarial traz alívio ao ambiente econômico.,PETR4,1,['Alívio com maior previsibilidade na gestão da empresa'],4.710288145369793,-0.716579977171812,,,,
48,O preço das ações é ajustado para baixo na data ex-dividendo.,PETR4,1,"['Ações passaram a ser negociadas ex-dividendos a partir de 22/08/2025, levando a ajuste negativo no preço']",2.876355025046672,0.5907460099511745,,,,
49,Impacto do resultado do primeiro turno das eleições presidenciais nos mercados.,PETR4,1,['Resultado do primeiro turno das eleições presidenciais'],7.986585336673237,,,,,
