cluster,frase_exemplo,ativo_cluster,n_eventos,frases_originais,seq_d0,seq_d1,seq_d2,seq_d3,seq_d4,seq_d5
0,Resultados trimestrais e expectativas do mercado influenciam a reação dos investidores.,PETR4,18,"['Divulgação de resultados trimestrais acima do esperado', 'Resultados trimestrais acima do esperado', 'Expectativa positiva sobre resultados trimestrais', 'Expectativa positiva para resultados trimestrais', 'Resultados trimestrais positivos', 'Expectativa positiva para resultados financeiros', 'Divulgação de resultados financeiros positivos', 'resultados trimestrais acima do esperado', 'Reação ao balanço trimestral', 'Divulgação de resultados trimestrais abaixo do esperado', 'Resultados trimestrais abaixo do esperado', 'Expectativa positiva com resultados trimestrais', 'Expectativas positivas para resultados trimestrais', 'Surpresa negativa para investidores', 'Surpresa negativa em relação às expectativas dos investidores', 'Resultados trimestrais acima do esperado, com lucro líquido e geração de caixa superiores às estimativas dos analistas', 'Dividendos anunciados abaixo das expectativas do mercado', 'Divulgação de resultados trimestrais positivos']",0.1412072646186233,0.014772518848135241,1.3899292064154876,-0.7666553328756162,-0.16131193510160202,-0.033137258830623816
1,Variações nos preços internacionais do petróleo impactam diretamente os mercados e a economia global.,PETR4,34,"['Alta nos preços internacionais do petróleo', 'Queda do preço internacional do petróleo', 'Alta do preço do petróleo', 'queda nos preços internacionais do petróleo', 'Queda nos preços internacionais do petróleo', 'Alta dos preços internacionais do petróleo', 'Alta do preço internacional do petróleo', 'Queda dos preços internacionais do petróleo', 'queda do preço do petróleo', 'alta do petróleo no mercado internacional', 'Queda nos preços do petróleo', 'queda do preço internacional do petróleo', 'queda nos preços do petróleo', 'O preço do petróleo Brent subiu 41% em 2021, atingindo em junho o maior valor em dois anos, com o barril fechando a US$ 74,39 em 16/06/2021 e a US$ 74,49 em 21/06/2021.', 'A alta do petróleo reflete a retomada econômica global pós-pandemia, com aumento da demanda devido ao fim dos isolamentos e estímulos econômicos.', 'Queda acentuada do preço do petróleo', 'Recuperação dos preços do petróleo', 'queda dos preços internacionais do petróleo', 'Alta volatilidade e incerteza nos preços do petróleo', 'volatilidade nos preços internacionais do petróleo', 'Volatilidade nos preços internacionais do petróleo', 'Queda das cotações internacionais do petróleo', 'Queda do preço do petróleo', 'Alta do petróleo no mercado internacional', 'Alta do petróleo', 'Alta nos preços do petróleo', 'Aumento dos estoques de petróleo nos EUA', 'Alta dos preços do petróleo', 'Queda acentuada do preço do petróleo Brent, que atingiu mínimas de quatro anos e ficou abaixo de US$ 60/barril', 'Cenário internacional favorável ao setor de petróleo', 'Estabilidade nos preços internacionais do petróleo', 'Cenário de preços do petróleo Brent em queda e projeções mais cautelosas para demanda interna', 'Valorização do petróleo', 'Oscilação do preço internacional do petróleo']",0.19880423773602873,0.16365226260769566,0.1989095340459545,-0.36842926751570565,-1.8549779286837826,-0.17183815020983179
2,Alívio no sentimento global de risco após queda anterior,PETR4,2,"['reação técnica após queda acentuada', 'Alívio no sentimento global de risco após queda anterior']",7.270750621931223,,,,,
3,Declarações de Lula sobre política de preços e responsabilidade fiscal geram preocupações sobre possível intervenção estatal no mercado.,PETR4,6,"['Temor de intervenção estatal após declarações de Lula', 'Declarações de Lula sobre política de preços e governança', 'Declarações de Lula sobre responsabilidade fiscal', 'Sinalizações de Lula sobre política de preços', 'Declarações de Lula sobre política de preços', 'Declarações de Lula sobre política de preços da Petrobras']",0.8095806304651111,-0.7165017063258328,,,,
4,Incertezas e expectativas quanto à manutenção da governança corporativa impactam a previsibilidade e a rentabilidade das empresas.,PETR4,9,"['Declarações do governo sobre governança', 'Expectativa de continuidade da governança corporativa', 'Incertezas sobre a governança e autonomia da empresa', 'Incertezas sobre governança e previsibilidade dos resultados', 'Incertezas sobre governança e previsibilidade dos lucros', 'Sinalizações do governo sobre respeito à governança', 'Expectativa de manutenção da governança corporativa', 'Incertezas sobre governança e rentabilidade futura', 'preocupações com governança corporativa']",-1.3335192736221102,1.5508917768851618,0.547592406562659,0.9216832382227496,,
5,Reoneração parcial do PIS/Cofins sobre combustíveis,PETR4,2,"['Reoneração parcial do PIS/Cofins sobre combustíveis', 'Sancionamento do teto do ICMS sobre combustíveis']",-0.952254006012238,,,,,
6,Cenário político doméstico instável,PETR4,3,"['Estabilidade no cenário eleitoral brasileiro', 'Cautela com cenário político', 'Cenário político doméstico instável']",-1.0566521429437596,0.507403543019409,1.2427274216937971,,,
7,Ajustes de portfólio realizados por investidores em função do vencimento de opções.,PETR4,2,"['Vencimento de opções e ajustes de portfólio', 'ajustes de portfólio de investidores']",-2.258463601444638,-2.8630789509502277,,,,
8,Oscilações no apetite ao risco influenciam o comportamento do mercado brasileiro.,PETR4,3,"['movimento de aversão ao risco no mercado brasileiro', 'Movimento mais amplo de otimismo no mercado doméstico, com maior apetite a risco e alocação de capital em mercados emergentes', 'Movimento geral do mercado brasileiro']",0.3858268835348461,0.8406660952972511,0.0829444824323518,-0.0828757415774384,0.22122704534510962,1.5452618904301898
9,Diminuição do risco de intervenção governamental impacta o mercado.,PETR4,3,"['Redução de temores sobre intervenção governamental', 'Alívio com menor risco de intervenção estatal imediata', 'temores de intervenção governamental']",1.2216230155476095,,,,,
10,"Aversão ao risco influencia os mercados globais e emergentes diante de fatores econômicos, políticos e fiscais.",PETR4,12,"['Realização de lucros e aversão ao risco global devido à Covid-19', 'Aversão ao risco em mercados emergentes', 'Aversão ao risco global', 'Aversão ao risco no mercado brasileiro devido a preocupações fiscais e políticas', 'Aversão global ao risco nos mercados', 'Aversão ao risco global e temores sobre a economia chinesa', 'Aversão ao risco global após dados de inflação dos EUA', 'Aversão global ao risco após decisão do Fed', 'Aversão ao risco em emergentes e commodities', 'Aversão ao risco em mercados globais', 'Aversão ao risco no mercado global', 'Aversão ao risco devido ao cenário político e fiscal brasileiro']",-3.0745801108094137,-0.16954633784578924,1.6660247600633307,,,
11,O mercado apresenta otimismo e expectativas positivas em relação ao setor de energia.,PETR4,9,"['Expectativas positivas para o setor de energia', 'Otimismo com o setor de energia', 'Otimismo do mercado com o setor de energia', 'Perspectiva positiva para a demanda global de energia', 'Perspectiva positiva para o setor de energia', 'Otimismo global com o setor de energia', 'Perspectiva positiva para empresas de energia', 'Otimismo do mercado em relação ao setor de energia', 'Movimento negativo do setor de energia global']",2.626741522129453,1.3444029056078526,,,,
12,realização de lucros,PETR4,14,"['realização de lucros após alta do mês', 'realização de lucros', 'realização de lucros por investidores', 'movimento de realização de lucros após altas anteriores', 'realização de lucros no mercado', 'Realização de lucros por investidores', 'realização de lucros após altas anteriores', 'Movimento de realização de lucros após altas anteriores', 'realização de lucros após alta recente', 'Movimento de realização de lucros após divulgação de resultados recentes', 'Movimento de realização de lucros no setor de energia', 'movimento de realização de lucros no setor', 'realização de lucros pelo mercado', 'realização de lucros após altas recentes']",-2.7228425171105406,0.4114143045782324,2.631593448071792,0.4930958527153092,,
13,"Otimismo predominante com a recuperação econômica global e brasileira, apesar de incertezas e riscos de recessão.",PETR4,11,"['Otimismo global com pacotes de estímulo econômico', 'Otimismo global com recuperação econômica', 'Otimismo com recuperação econômica global', 'Otimismo com a recuperação econômica global', 'Temores de recessão global', 'Reação positiva ao cenário macroeconômico global', 'Otimismo com o cenário macroeconômico brasileiro', 'Otimismo com o cenário macroeconômico global', 'Otimismo com o cenário econômico brasileiro', 'Otimismo com dados econômicos brasileiros', 'incertezas macroeconômicas globais']",1.5908396550176507,-0.27241620155651025,,,,
14,"Incertezas e expectativas sobre intervenção política, governança e política de preços da Petrobras impactam o mercado.",PETR4,65,"['Sinalização de troca do presidente da Petrobras por Jair Bolsonaro', 'Anúncio da substituição do presidente da Petrobras', 'Troca do presidente da Petrobras anunciada pelo governo', 'Troca recente na presidência da Petrobras', 'Intervenção do governo na presidência da Petrobras', 'Alívio após turbulências políticas na Petrobras', 'Sinalização de manutenção da política de preços da Petrobras', 'Incertezas sobre a política de preços da Petrobras', 'Confirmação do novo presidente da Petrobras', 'Posse de novo presidente da Petrobras', 'Expectativas positivas com a nova gestão da Petrobras', 'Aumento do dividendo anunciado pela Petrobras, apesar da queda no preço do petróleo Brent.', 'Resiliência financeira da Petrobras, conseguindo compensar a queda do Brent com maior produção', 'Confirmação da política de preços da Petrobras', 'Expectativas positivas sobre resultados financeiros da Petrobras', 'Expectativa positiva para resultados financeiros da Petrobras', 'Temor de intervenção do governo na política de preços da Petrobras', 'Manutenção da política de preços da Petrobras', 'Expectativas positivas sobre a política de preços da Petrobras', 'Expectativa de resultados financeiros positivos da Petrobras', 'Incertezas sobre política de preços da Petrobras', 'Anúncio de troca do presidente da Petrobras', 'Demissão do presidente da Petrobras', 'Indicação de novo presidente para a Petrobras', 'Otimismo com resultados operacionais da Petrobras', 'Indicação de Caio Paes de Andrade para presidência da Petrobras', 'Temor de intervenção política na Petrobras', 'Incertezas sobre governança da Petrobras', 'Troca na presidência da Petrobras', 'Renúncia do presidente da Petrobras', 'Posse do novo presidente da Petrobras', 'temores de intervenção governamental na Petrobras', 'Redução de incertezas políticas em relação à Petrobras', 'temores de interferência política na Petrobras', 'Expectativas positivas sobre dividendos da Petrobras', 'Temor de mudanças na política de preços da Petrobras', 'temores sobre mudanças na política de preços da Petrobras', 'preocupações sobre política de preços da Petrobras', 'Temor de intervenção estatal e mudanças na política de preços da Petrobras', 'Incerteza sobre política de preços da Petrobras', 'Preocupações com intervenção do governo na Petrobras', 'Temor de intervenção política na gestão da Petrobras', 'Alívio quanto à governança da Petrobras', 'Incertezas políticas sobre a futura gestão da Petrobras', 'Incertezas políticas sobre a Petrobras', 'Indicação de Jean Paul Prates para presidência da Petrobras', 'Indicação de Jean Paul Prates para presidência', 'Preocupações sobre mudanças na política de preços da Petrobras', 'Incertezas sobre a política de preços da Petrobras no novo governo', 'Declarações do governo sobre governança da Petrobras', 'Incertezas sobre a governança da Petrobras', 'Incertezas sobre a política de preços e governança da Petrobras', 'Temor de intervenção governamental na Petrobras', 'Confiança na governança da Petrobras', 'Expectativas sobre dividendos da Petrobras', 'Expectativas positivas sobre política de preços da Petrobras', 'Temor de interferência política na gestão da Petrobras', 'Sinalização do governo de respeito à governança da Petrobras', 'Expectativa de aumento de receitas para a Petrobras', 'Rumores de interferência do governo na Petrobras', 'Temor de maior intervenção política na Petrobras', 'Incertezas sobre política de dividendos da Petrobras', 'incertezas sobre política de preços da Petrobras', 'Expectativa de pagamento de dividendos extraordinários pela Petrobras, após sinalização do governo sobre a importância desses recursos para o ajuste fiscal', 'Especulações sobre política de preços da Petrobras']",-0.9090888485688315,-1.5677224802589387,-0.47321997741076155,0.49670263423179256,0.21651754050802624,
15,Alívio pós-eleições presidenciais,PETR4,2,"['Alívio nas tensões políticas no Brasil', 'Alívio pós-eleições presidenciais']",2.7663382078092207,,,,,
16,Incertezas e preocupações sobre intervenção governamental na política de preços dos combustíveis.,PETR4,33,"['Preocupações com interferência do governo na política de preços', 'Incertezas sobre reajustes de combustíveis', 'Temor de interferência política na política de preços dos combustíveis', 'Preocupações com intervenção política e política de preços de combustíveis', 'Receio de interferência política na política de preços de combustíveis', 'Incerteza sobre política de preços dos combustíveis', 'Reação à manutenção da política de preços', 'Incertezas sobre a política de preços de combustíveis', 'Alívio após incertezas sobre a política de preços', 'Temor de intervenção na política de preços', 'Temores de intervenção governamental na política de preços', 'Sinalização do governo de não interferência na política de preços', 'Temor de intervenção do governo na política de preços', 'preocupação com intervenção do governo na política de preços', 'incertezas sobre políticas de combustíveis no Brasil', 'Incertezas sobre políticas de preços de combustíveis no Brasil', 'Temor de intervenção política na política de preços', 'Expectativa de mudanças na política de preços', 'Expectativa de manutenção da política de preços', 'Sinalização de manutenção da política de preços', 'Incertezas sobre a política de preços dos combustíveis', 'Incertezas sobre política de preços dos combustíveis', 'Incertezas sobre política de preços', 'Expectativas positivas sobre política de preços', 'Realização de lucros e incertezas sobre política de preços', 'Sinalização do governo sobre não interferência na política de preços', 'Preocupações com intervenção do governo na política de preços', 'Mudança na política de preços dos combustíveis', 'Alívio de temores sobre intervenção estatal na política de preços', 'Preocupações com mudanças na política de preços dos combustíveis', 'Incertezas sobre política de preços de combustíveis', 'temores sobre intervenção governamental na política de preços', 'rumores de interferência do governo na política de preços']",-1.542774870877622,-1.5968600357788494,0.2639957493908071,0.49670263423179256,0.21651754050802624,
17,O desempenho de PETR4 reflete tanto o movimento do setor e do mercado quanto ajustes nas expectativas sobre o preço do petróleo.,PETR4,2,"['Revisão para baixo do preço-alvo de PETR4 por analistas, refletindo premissas mais conservadoras para o preço do Brent', 'PETR4 acompanhou a alta do Ibovespa e o bom desempenho do setor de petróleo, mesmo sem notícias específicas da companhia']",0.45094067673334726,0.42706497772607976,0.0829444824323518,-0.0828757415774384,0.22122704534510962,1.5452618904301898
18,"Expectativas, anúncios e revisões na política de dividendos impactam diretamente o interesse dos investidores e a valorização das ações.",PETR4,31,"['Resultados financeiros positivos e expectativa de distribuição de dividendos elevados.', 'Anúncio de pagamento de dividendos expressivos', 'Expectativa de pagamento de dividendos elevados, mesmo com queda do preço do Brent', 'Expectativas de dividendos elevados', 'Anúncio de pagamento de dividendos elevados', 'Anúncio de dividendos elevados', 'divulgação de dividendos extraordinários', 'Divulgação de dividendos extraordinários', 'Anúncio de dividendos extraordinários', 'Expectativas positivas sobre dividendos', 'Perspectiva de dividendos elevados', 'Expectativa de manutenção da política de dividendos', 'Expectativas positivas sobre a transição de governo e política de dividendos', 'Incertezas sobre política de preços e dividendos', 'Temor de intervenção do governo na política de dividendos', 'Expectativa de dividendos elevados', 'Incertezas sobre a governança e distribuição de dividendos', 'Preocupações com política de dividendos', 'Anúncio de dividendos', 'Anúncio de pagamento de dividendos', 'Expectativa positiva sobre dividendos', 'Redução no pagamento de dividendos', 'Expectativas sobre dividendos', 'Perspectiva de manutenção da política de dividendos', 'Anúncio de revisão da política de dividendos', 'Manutenção da política de dividendos', 'Decisão de não pagamento de dividendos extraordinários', 'Expectativa de dividendos extraordinários', 'Manutenção de recomendação de compra por analistas, com destaque para dividendos elevados e perspectiva de recuperação', 'Expectativa de pagamento de dividendos elevados no próximo trimestre, estimados em US$ 2,2 bilhões, o que atraiu investidores', 'Perspectiva de menor pagamento de dividendos extraordinários devido ao aumento de investimentos e queda do preço do petróleo']",1.418125926175188,0.413131925093997,-0.10883956671548357,-0.2720628648761459,-0.5155834489532416,0.1255990342999074
19,Expectativas do mercado sobre o desempenho das commodities variam conforme o cenário internacional.,PETR4,6,"['Otimismo do mercado com commodities', 'Otimismo com commodities no cenário internacional', 'Cenário externo favorável para commodities', 'Otimismo do mercado com o setor de commodities', 'Cenário externo desfavorável para commodities', 'Otimismo global com commodities']",1.1748730744874358,0.5438523739747615,,,,
20,Incertezas sobre variantes da Covid-19 afetam as expectativas para a demanda global.,PETR4,6,"['Temor global com nova variante da Covid-19', 'Temores sobre a demanda global devido à variante Delta', 'Preocupações com a demanda global devido à Covid-19', 'Temores sobre a variante Delta da Covid-19', 'Preocupações globais com a variante Ômicron da Covid-19', 'Temores globais com a variante Ômicron']",-3.3622901028157686,2.4428929064980034,-1.9964288141095818,,,
21,O conflito entre Rússia e Ucrânia impacta a oferta e gera preocupações nos mercados.,PETR4,4,"['Invasão da Ucrânia pela Rússia', 'Escalada do conflito Rússia-Ucrânia', 'Conflito entre Rússia e Ucrânia elevando preocupações sobre oferta', 'Conflito Rússia-Ucrânia']",-0.9869578900785926,,,,,
22,Desempenho do lucro líquido em relação às expectativas dos analistas.,PETR4,2,"['Lucro líquido superior às estimativas dos analistas', 'Lucro líquido menor que o projetado por analistas']",-0.011394870960640624,0.32640793300022775,,,,
23,A alta do preço do petróleo impulsiona receitas e lucros de empresas de exploração e produção como a Petrobras.,PETR4,2,"['A política de preços da Petrobras acompanha o mercado internacional, beneficiando-se da valorização do petróleo.', 'O cenário de preços elevados do petróleo favorece empresas do setor de exploração e produção, como a Petrobras, aumentando expectativas de receitas e lucros.']",2.2245792884262734,0.5181533322912533,0.6872776838580447,1.1945501506022655,-1.8549779286837826,-0.17183815020983179
24,Produção de petróleo atinge recordes operacionais com entrada de novos FPSOs no 3T25.,PETR4,4,"['Crescimento da produção de petróleo para mais de 2,5 milhões de barris por dia, com recordes operacionais.', 'Aumento expressivo da produção de petróleo e gás, com recordes operacionais', 'Aumento significativo da produção de petróleo da Petrobras no 3T25, com recordes operacionais e entrada de novos FPSOs', 'Aumento expressivo da produção de petróleo no 3T25, com entrada de novos FPSOs e recordes operacionais']",1.3802565693447106,0.3069794263340115,1.8317115867884477,0.2085393677236669,0.1560924311455074,
25,Expansão e diversificação de operações por meio de aquisições e novas licenças exploratórias.,PETR4,2,"['Notícias sobre novas licenças de operação e expansão em blocos exploratórios, indicando crescimento futuro.', 'Notícias de expansão e diversificação, como aquisição de participação em bloco na África']",0.15543353819087535,-0.0003588526502083792,,,,
26,A aprovação do AIP da jazida de Jubarte pela ANP viabiliza operação conjunta e define participações futuras no campo.,PETR4,1,"['Aprovação do Acordo de Individualização da Produção (AIP) da jazida de Jubarte pela ANP, permitindo operação conjunta e maior clareza sobre participações futuras']",2.0414613901847725,-0.15629344533386835,,,,
27,Impacto negativo do colapso do SVB nos mercados globais.,PETR4,1,['Queda dos mercados globais após colapso do SVB'],-3.1625344482325346,,,,,
28,Avanços em vacinas contra Covid-19 impulsionam otimismo nos mercados globais.,PETR4,2,"['Notícias positivas sobre vacina da Pfizer contra Covid-19', 'Otimismo global com vacinas contra Covid-19']",,,,,,
29,Previsão de redução na oferta global impacta mercados.,PETR4,1,['Expectativas de oferta global mais restrita'],2.38312517800255,4.297233752849169,0.7439319110012331,,,
30,Incertezas fiscais e políticas elevam o risco econômico no Brasil.,PETR4,9,"['Preocupações fiscais no Brasil', 'Incertezas fiscais no Brasil', 'Aumento das preocupações fiscais e políticas no Brasil', 'Aumento da aversão ao risco e preocupações fiscais no Brasil', 'preocupações fiscais no Brasil', 'Incertezas fiscais e políticas no Brasil', 'Preocupações com o cenário fiscal no Brasil', 'incertezas fiscais no Brasil', 'incertezas políticas e fiscais no Brasil']",-3.4298086160913988,0.5648182756414185,,,,
31,Alta da Selic pelo Banco Central,PETR4,1,['Alta da Selic pelo Banco Central'],-3.4883658749443853,,,,,
32,A atratividade do ativo decorre do alto dividend yield e da predominância das vendas no mercado interno.,PETR4,1,['Percepção de segurança e atratividade do ativo devido ao alto dividend yield e vendas majoritariamente no mercado interno'],-2.419071329666858,-0.0003588526502083792,,,,
33,Monitoramento do desempenho favorável dos mercados acionários internacionais.,PETR4,1,['Acompanhamento do desempenho positivo de bolsas globais'],2.1381222231843076,,,,,
34,Impactos econômicos e de mercado da demissão do CEO Jean Paul Prates.,PETR4,1,['Demissão do CEO Jean Paul Prates'],-6.043534132683287,,,,,
35,Redução da produção nos EUA após furacão Ida,PETR4,1,['Redução da produção nos EUA após furacão Ida'],3.512220878730317,-1.334346059043194,,,,
36,Risco de influência política nas decisões empresariais.,PETR4,3,"['Temor de interferência política na gestão da empresa', 'Temor de intervenção estatal na empresa', 'Preocupações com possível ingerência política na empresa']",-10.18413870363181,1.4992965151538529,,,,
37,Divulgação de dados operacionais e de produção positivos impulsiona expectativas de mercado.,PETR4,3,"['Divulgação de dados positivos de produção', 'Divulgação de dados operacionais positivos', 'Dados positivos de produção']",3.118744045997649,-0.09106443415694397,-0.2734778739566914,-2.4984746300034244,,
38,Alta do petróleo devido ao conflito Israel-Hamas,PETR4,1,['Alta do petróleo devido ao conflito Israel-Hamas'],4.297233752849169,0.7439319110012331,,,,
39,"Superação de médias móveis importantes, sugerindo força técnica do papel.",PETR4,1,"['Superação de médias móveis importantes, sugerindo força técnica do papel.']",2.7299384060486087,,,,,
40,Redução do preço da gasolina anunciada pela Petrobras,PETR4,2,"['Redução do preço da gasolina anunciada pela Petrobras', 'Redução do preço da gasolina nas refinarias']",2.158477592897661,-0.03424604385008794,,,,
41,Desempenho operacional consistente e geração de caixa resiliente mesmo com preços do Brent em queda.,PETR4,1,"['Resultados operacionais sólidos, com EBITDA em linha com o consenso e boa geração de caixa, apesar do Brent mais baixo']",3.083693797201926,0.6143177053182314,1.8317115867884477,0.2085393677236669,0.1560924311455074,
42,Incertezas políticas e eleitorais impactam o ambiente econômico e de mercado no Brasil.,PETR4,7,"['Incertezas políticas pós-eleição', 'Incerteza política após eleições', 'incerteza eleitoral no Brasil', 'incerteza eleitoral', 'Incertezas políticas com o novo governo', 'incertezas políticas no Brasil', 'Incertezas políticas']",-3.7566186933657795,,,,,
43,Impactos econômicos da vitória de Lula nas eleições presidenciais.,PETR4,1,['Vitória de Lula nas eleições presidenciais'],-8.47405623220931,,,,,
44,Expectativa de corte de produção pela Opep+,PETR4,1,['Expectativa de corte de produção pela Opep+'],3.761570501813864,,,,,
